{
  "action": "subscribed",
  "action_label": "订阅成功",
  "subtitle": "微博 · 订阅中心",
  "platform": "微博",
  "user": {
    "name": "RayleaBot 示例博主",
    "uid": "6000000009",
    "avatar": "",
    "fans_text": "粉丝 128.6万",
    "sign": "这个简介用于检查资料卡片的长文本截断效果，简介区域最多展示两行，超出部分会被收起，头像、昵称、UID 和粉丝数保持稳定布局。"
  },
  "uid_text": "UID 6000000009",
  "fans_text": "粉丝 128.6万",
  "verify_text": "微博认证：知名科技博主",
  "verify_org": false,
  "services_text": "微博、图片、视频",
  "service_labels": ["微博", "图片", "视频"],
  "target_text": "订阅到：RayleaBot 测试群"
}
